{
  "name": "feature-executor",
  "type": "task",
  "backend": "codex",
  "pipeline": {
    "quality_gate": {
      "tools": ["reviewer"],
      "retry": {
        "max_attempts": 2,
        "initial_delay_ms": 500,
        "backoff_ms": 200
      },
      "transitions": {
        "on_success": {
          "action": "next",
          "next_stage": "execute",
          "condition": "true"
        },
        "on_failure": {
          "action": "retry",
          "condition": "review_failed"
        }
      }
    },
    "execute": {
      "tools": ["shell", "git", "reviewer"],
      "retry": {
        "max_attempts": 3,
        "initial_delay_ms": 200,
        "backoff_ms": 300
      },
      "transitions": {
        "on_success": {
          "action": "next",
          "next_stage": "qc_gate",
          "condition": "true"
        },
        "on_failure": {
          "action": "retry",
          "condition": "tests_failed"
        }
      }
    },
    "qc_gate": {
      "tools": ["quality-checker"],
      "retry": {
        "max_attempts": 2,
        "initial_delay_ms": 300
      },
      "transitions": {
        "on_success": {
          "action": "next",
          "next_stage": "complete",
          "condition": "quality_score >= threshold"
        },
        "on_failure": {
          "action": "fail",
          "condition": "review_failed"
        }
      }
    },
    "complete": {
      "tools": ["git"],
      "retry": {
        "max_attempts": 1
      },
      "transitions": {
        "on_success": {
          "action": "complete",
          "condition": "true"
        },
        "on_failure": {
          "action": "fail",
          "condition": "true"
        }
      }
    }
  }
}
